species_name,root_disease,foliar_disease,disease,disease2,ref,,
Phytophthora virginiana,0,0,Isolated from irrigation water,host unknown,,,
Phytophthora vulcanica,1,0,Pathogenic to roots in pathogenicity tests,,,,
Phytophthora x alni,1,0,"Aggressive root and collar rot of riparian, nursery and shelterbelt alders",,,,
Phytophthora x andina,0,1,Blight,,,,
Phytophthora x heterohybrida,1,0,"pathogenicity tests on C. sativa, F. sylvatica, Q. suber: Phytophthora xheterohybrida caused mortality (Fig. 13b), collar rot (Fig. 13f) and necrotic root lesions or dieback of taproots (Fig. 13h) in 6.7 %, 20.0 % and 80 % of plants, respectively, and on average 63.3 % root rot and 48.3 % reduction of fine root weight  ",,,,
Phytophthora x incrassata,1,0,Isolated from river water,"pathogenicity tests on C. sativa F. sylvatica and Q. suber: Phytophthora xincrassata caused mortality (Fig. 13c), partly girdling collar rot infections (Fig. 13e) and necrotic root lesions or dieback of taproots ",,,
Phytophthora x multiformis,1,0,necrotic lesions in the inner bark," roots, collar",,,
Phytophthora x pelgrandis,1,0,"Root Rot and Lower Stem Necrosis of Common Box, Lavender and Port-Orford-Cedar in Hungary",,,,
Phytophthora x serendipita,1,0,bark necrosis and 100% root rot causing the decline of 11 poplar plants in soil infestation trials,,"Milenkovic et al. 2018 Forests 9, 330",,
Phytophthora x stagnum,NA,NA,recovered from irrigation reservoirs at several ornamental plant production facilities,no pathogenicity tests,,,
